{
  "$schema": "https://json-schema.org/draft/2020-12/schema",
  "$id": "defense-factory://attack-path-analysis/attack-paths.schema.json",
  "title": "Defense Factory stage 3b attack-path record (attack-paths.json)",
  "description": "Written by the agent, normalized by normalize_attack_paths.py (which adds id and priority and orders the analyses), checked by check_attack_paths.py (which recomputes the severity policy), and rendered to attack-paths.md by render_attack_paths.py.",
  "type": "object",
  "properties": {
    "record": {
      "$ref": "#/$defs/record"
    },
    "validated_record": {
      "$ref": "#/$defs/fileRef"
    },
    "threat_model": {
      "description": "The stage 1 model whose severity calibration table was applied; null when stage 2 was a narrow scan.",
      "anyOf": [
        {
          "type": "null"
        },
        {
          "$ref": "#/$defs/fileRef"
        }
      ]
    },
    "security_guidance": {
      "description": "The resolved security policy from the stage 2 run; null when none was saved.",
      "anyOf": [
        {
          "type": "null"
        },
        {
          "$ref": "#/$defs/fileRef"
        }
      ]
    },
    "analyses": {
      "type": "array",
      "items": {
        "$ref": "#/$defs/analysis"
      }
    },
    "not_eligible": {
      "type": "array",
      "items": {
        "$ref": "#/$defs/notEligible"
      }
    },
    "open_questions": {
      "$ref": "#/$defs/textList"
    }
  },
  "required": [
    "record",
    "validated_record",
    "threat_model",
    "security_guidance",
    "analyses",
    "not_eligible",
    "open_questions"
  ],
  "additionalProperties": false,
  "$defs": {
    "text": {
      "type": "string",
      "pattern": "\\S"
    },
    "textList": {
      "type": "array",
      "items": {
        "$ref": "#/$defs/text"
      }
    },
    "boolean": {
      "enum": [
        true,
        false
      ]
    },
    "rating": {
      "enum": [
        "high",
        "medium",
        "low",
        "ignore",
        "unknown"
      ]
    },
    "fileRef": {
      "type": "object",
      "properties": {
        "path": {
          "type": "string",
          "pattern": "\\S",
          "description": "Relative to the folder holding attack-paths.json."
        },
        "sha256": {
          "type": "string",
          "pattern": "^[0-9a-f]{64}$"
        },
        "run_id": {
          "type": "string",
          "pattern": "^[A-Za-z0-9._-]+$"
        }
      },
      "required": [
        "path",
        "sha256"
      ],
      "additionalProperties": false
    },
    "location": {
      "type": "object",
      "properties": {
        "path": {
          "type": "string",
          "pattern": "\\S"
        },
        "start_line": {
          "type": "integer",
          "minimum": 1
        },
        "end_line": {
          "type": "integer",
          "minimum": 1
        },
        "role": {
          "enum": [
            "entrypoint",
            "source",
            "root_control",
            "sink",
            "concrete_implementation",
            "evidence"
          ]
        }
      },
      "required": [
        "path",
        "start_line",
        "end_line",
        "role"
      ],
      "additionalProperties": false
    },
    "record": {
      "type": "object",
      "properties": {
        "record_version": {
          "const": 1
        },
        "stage": {
          "const": "3b-attack-path-analysis"
        },
        "status": {
          "enum": [
            "complete",
            "inconclusive",
            "blocked"
          ]
        },
        "run_id": {
          "type": "string",
          "pattern": "^[A-Za-z0-9._-]+$"
        },
        "timestamp": {
          "type": "string",
          "pattern": "^\\d{4}-\\d{2}-\\d{2}T\\d{2}:\\d{2}:\\d{2}Z$"
        },
        "actor": {
          "$ref": "#/$defs/text"
        },
        "model": {
          "$ref": "#/$defs/text"
        },
        "skill_version": {
          "type": "string",
          "pattern": "^attack-path-analysis/sha256:[0-9a-f]{16}$"
        },
        "target_id": {
          "$ref": "#/$defs/text"
        },
        "target_kind": {
          "enum": [
            "git_revision",
            "git_worktree",
            "directory_snapshot"
          ]
        },
        "version": {
          "$ref": "#/$defs/text"
        },
        "revision": {
          "anyOf": [
            {
              "type": "null"
            },
            {
              "$ref": "#/$defs/text"
            }
          ]
        },
        "scope": {
          "anyOf": [
            {
              "const": "whole-repository"
            },
            {
              "type": "array",
              "minItems": 1,
              "uniqueItems": true,
              "items": {
                "$ref": "#/$defs/text"
              }
            }
          ]
        },
        "authorization": {
          "$ref": "#/$defs/text"
        },
        "output_location": {
          "$ref": "#/$defs/text"
        },
        "source": {
          "const": "validated-record"
        },
        "inputs": {
          "$ref": "#/$defs/textList"
        },
        "tools": {
          "$ref": "#/$defs/text"
        },
        "evidence": {
          "$ref": "#/$defs/text"
        },
        "assumptions": {
          "$ref": "#/$defs/textList"
        },
        "coverage_gaps": {
          "$ref": "#/$defs/textList"
        },
        "next_action": {
          "$ref": "#/$defs/text"
        }
      },
      "required": [
        "record_version",
        "stage",
        "status",
        "run_id",
        "timestamp",
        "actor",
        "model",
        "skill_version",
        "target_id",
        "target_kind",
        "version",
        "revision",
        "scope",
        "authorization",
        "output_location",
        "source",
        "inputs",
        "tools",
        "evidence",
        "assumptions",
        "coverage_gaps",
        "next_action"
      ],
      "additionalProperties": false
    },
    "facts": {
      "type": "object",
      "properties": {
        "in_scope": {
          "enum": [
            "yes",
            "no",
            "unknown"
          ]
        },
        "security_vulnerability": {
          "enum": [
            "yes",
            "no",
            "unknown"
          ]
        },
        "product_surface": {
          "enum": [
            "yes",
            "no",
            "unknown"
          ]
        },
        "vector": {
          "enum": [
            "remote",
            "local_network",
            "localhost",
            "none",
            "unknown"
          ]
        },
        "auth_scope": {
          "enum": [
            "public",
            "internal-only",
            "admin-only",
            "not-applicable",
            "unknown"
          ]
        },
        "cross_boundary": {
          "enum": [
            "yes",
            "no",
            "unknown"
          ]
        },
        "preconditions": {
          "enum": [
            "plausible",
            "unlikely",
            "unachievable",
            "unknown"
          ]
        },
        "attacker_input_control": {
          "enum": [
            "yes",
            "plausible",
            "no",
            "unknown"
          ]
        },
        "exposure": {
          "$ref": "#/$defs/text"
        },
        "identity": {
          "$ref": "#/$defs/text"
        },
        "impact_surface": {
          "$ref": "#/$defs/text"
        },
        "target_reach": {
          "$ref": "#/$defs/text"
        },
        "controls": {
          "$ref": "#/$defs/text"
        },
        "secrets": {
          "$ref": "#/$defs/text"
        },
        "blind_spots": {
          "$ref": "#/$defs/text"
        }
      },
      "required": [
        "in_scope",
        "security_vulnerability",
        "product_surface",
        "vector",
        "auth_scope",
        "cross_boundary",
        "preconditions",
        "attacker_input_control",
        "exposure",
        "identity",
        "impact_surface",
        "target_reach",
        "controls",
        "secrets",
        "blind_spots"
      ],
      "additionalProperties": false
    },
    "counterevidence": {
      "type": "object",
      "properties": {
        "fact": {
          "$ref": "#/$defs/text"
        },
        "evidence": {
          "$ref": "#/$defs/text"
        },
        "dispositive": {
          "$ref": "#/$defs/boolean"
        }
      },
      "required": [
        "fact",
        "evidence",
        "dispositive"
      ],
      "additionalProperties": false
    },
    "analysis": {
      "type": "object",
      "properties": {
        "id": {
          "type": "string",
          "pattern": "^AP-[1-9][0-9]*$"
        },
        "validation_id": {
          "type": "string",
          "pattern": "^VD-[1-9][0-9]*$"
        },
        "finding_id": {
          "type": "string",
          "pattern": "^FD-[1-9][0-9]*$"
        },
        "finding_key": {
          "type": "string",
          "pattern": "^[a-z0-9][a-z0-9._-]*$"
        },
        "finding_fingerprint": {
          "anyOf": [
            {
              "type": "null"
            },
            {
              "type": "string",
              "pattern": "^fp:[0-9a-f]{16}$"
            }
          ]
        },
        "title": {
          "$ref": "#/$defs/text"
        },
        "verdict": {
          "enum": [
            "confirmed",
            "inconclusive"
          ]
        },
        "locations": {
          "type": "array",
          "minItems": 1,
          "items": {
            "$ref": "#/$defs/location"
          }
        },
        "facts": {
          "$ref": "#/$defs/facts"
        },
        "attacker_steps": {
          "type": "array",
          "minItems": 1,
          "items": {
            "$ref": "#/$defs/text"
          }
        },
        "dataflow": {
          "$ref": "#/$defs/text"
        },
        "reachability": {
          "$ref": "#/$defs/text"
        },
        "counterevidence": {
          "type": "array",
          "minItems": 1,
          "items": {
            "$ref": "#/$defs/counterevidence"
          }
        },
        "impact": {
          "$ref": "#/$defs/rating"
        },
        "likelihood": {
          "$ref": "#/$defs/rating"
        },
        "critical_criteria_met": {
          "$ref": "#/$defs/boolean"
        },
        "suppression": {
          "anyOf": [
            {
              "type": "null"
            },
            {
              "enum": [
                "not-a-security-vulnerability",
                "out-of-scope",
                "self-only-impact",
                "unrealistic-preconditions",
                "privileged-attacker",
                "no-realistic-attacker-path"
              ]
            }
          ]
        },
        "calibration_override": {
          "description": "Only when stage 1's severity calibration table, cited here, gives this target a different level than the matrix. Codex Security's attack-path policy likewise lets the threat model justify an exception.",
          "type": "object",
          "properties": {
            "severity": {
              "enum": [
                "critical",
                "high",
                "medium",
                "low"
              ]
            },
            "row": {
              "$ref": "#/$defs/text"
            },
            "reason": {
              "$ref": "#/$defs/text"
            }
          },
          "required": [
            "severity",
            "row",
            "reason"
          ],
          "additionalProperties": false
        },
        "severity": {
          "enum": [
            "critical",
            "high",
            "medium",
            "low",
            "ignore",
            "unknown"
          ]
        },
        "severity_rationale": {
          "$ref": "#/$defs/text"
        },
        "change_conditions": {
          "$ref": "#/$defs/text"
        },
        "proof_gap": {
          "$ref": "#/$defs/text"
        },
        "decision": {
          "enum": [
            "reportable",
            "ignore",
            "deferred"
          ]
        },
        "priority": {
          "anyOf": [
            {
              "type": "null"
            },
            {
              "enum": [
                "P0",
                "P1",
                "P2",
                "P3"
              ]
            }
          ]
        },
        "confidence": {
          "type": "object",
          "properties": {
            "level": {
              "enum": [
                "High",
                "Medium",
                "Low"
              ]
            },
            "reason": {
              "$ref": "#/$defs/text"
            }
          },
          "required": [
            "level",
            "reason"
          ],
          "additionalProperties": false
        }
      },
      "required": [
        "validation_id",
        "finding_id",
        "finding_key",
        "title",
        "verdict",
        "locations",
        "facts",
        "attacker_steps",
        "dataflow",
        "reachability",
        "counterevidence",
        "impact",
        "likelihood",
        "critical_criteria_met",
        "suppression",
        "severity",
        "severity_rationale",
        "change_conditions",
        "decision",
        "confidence"
      ],
      "additionalProperties": false
    },
    "notEligible": {
      "type": "object",
      "properties": {
        "validation_id": {
          "type": "string",
          "pattern": "^VD-[1-9][0-9]*$"
        },
        "finding_id": {
          "type": "string",
          "pattern": "^FD-[1-9][0-9]*$"
        },
        "verdict": {
          "const": "rejected"
        },
        "reason": {
          "$ref": "#/$defs/text"
        }
      },
      "required": [
        "validation_id",
        "finding_id",
        "verdict",
        "reason"
      ],
      "additionalProperties": false
    }
  }
}
